{
  "$schema": "https://json-schema.org/draft/2020-12/schema",
  "$id": "https://erdesigns.eu/schema/drive-cycle.json",
  "title": "drive-cycle",
  "type": "object",
  "required": [
    "schema_version",
    "entries"
  ],
  "properties": {
    "$schema": {
      "type": "string"
    },
    "schema_version": {
      "const": 1
    },
    "version": {
      "type": "integer",
      "enum": [
        1,
        2
      ]
    },
    "description": {
      "type": "string"
    },
    "source": {
      "type": "string"
    },
    "spec": {
      "type": "string"
    },
    "type": {
      "type": "string"
    },
    "kind": {
      "type": "string"
    },
    "oem": {
      "type": "string"
    },
    "fields": {
      "type": "object",
      "additionalProperties": {
        "type": "string"
      }
    },
    "entries": {
      "type": "array",
      "items": {
        "type": "object",
        "required": [
          "monitor",
          "description",
          "duration_seconds"
        ],
        "properties": {
          "monitor": {
            "type": "string"
          },
          "description": {
            "type": "string"
          },
          "duration_seconds": {
            "type": "integer",
            "minimum": 0
          }
        },
        "additionalProperties": false
      }
    }
  },
  "additionalProperties": false
}
