{
  "$schema": "https://erdesigns.eu/schema/drive-cycle.json",
  "schema_version": 1,
  "spec": "ISO 15031-7",
  "description": "Generic per-monitor drive-cycle steps. Override per-OEM by registering a TDriveCycleResolver.",
  "entries": [
    {
      "monitor": "Misfire",
      "description": "Cold start, idle 30 s, accelerate to 90 km/h, cruise 5 min, decelerate without braking. Repeat once.",
      "duration_seconds": 600
    },
    {
      "monitor": "FuelSystem",
      "description": "Cruise at 80 km/h in closed loop for 5 minutes after warm-up.",
      "duration_seconds": 300
    },
    {
      "monitor": "Comprehensive",
      "description": "After warm-up, idle 30 s and cruise 5 min in closed loop.",
      "duration_seconds": 330
    },
    {
      "monitor": "Catalyst",
      "description": "Two stabilised cruises at 65 km/h for 3 min each, separated by 15 s of deceleration without braking.",
      "duration_seconds": 420
    },
    {
      "monitor": "HeatedCatalyst",
      "description": "Cold start; let the catalyst reach light-off temperature.",
      "duration_seconds": 600
    },
    {
      "monitor": "EvaporativeSystem",
      "description": "Cold start with fuel level between 1/4 and 3/4. Idle 4 min, cruise 50–80 km/h for 10 min.",
      "duration_seconds": 900
    },
    {
      "monitor": "SecondaryAirSystem",
      "description": "Cold start; idle until secondary air pump cycles off (~30–90 s).",
      "duration_seconds": 90
    },
    {
      "monitor": "OxygenSensor",
      "description": "Cruise at constant speed in closed loop for 10 minutes.",
      "duration_seconds": 600
    },
    {
      "monitor": "OxygenSensorHeater",
      "description": "Cold start; let oxygen sensors heat up (~30 s after start).",
      "duration_seconds": 60
    },
    {
      "monitor": "EGRorVVTSystem",
      "description": "Cruise at 80 km/h for 5 min, then decelerate to 30 km/h with foot off accelerator.",
      "duration_seconds": 360
    },
    {
      "monitor": "ACRefrigerant",
      "description": "Run A/C for at least 10 minutes at idle and cruise.",
      "duration_seconds": 600
    },
    {
      "monitor": "NMHCCatalyst",
      "description": "Diesel cold start; sustained cruise at 60–90 km/h for 15 min.",
      "duration_seconds": 900
    },
    {
      "monitor": "NOxAftertreatment",
      "description": "Diesel: highway cruise 80–100 km/h for 20 min after AdBlue dosing.",
      "duration_seconds": 1200
    },
    {
      "monitor": "BoostPressureSystem",
      "description": "Three full-throttle accelerations from 30–100 km/h with full warm-up.",
      "duration_seconds": 600
    },
    {
      "monitor": "ExhaustGasSensor",
      "description": "Cold start; 20 min mixed driving including idle and cruise.",
      "duration_seconds": 1200
    },
    {
      "monitor": "PMFilter",
      "description": "Diesel: cruise above 60 km/h for 20 min to reach regen temperature.",
      "duration_seconds": 1200
    },
    {
      "monitor": "EGRSystem",
      "description": "Cruise 60–80 km/h for 10 min after warm-up.",
      "duration_seconds": 600
    }
  ]
}